{
  "project": "2025-03-xitou",
  "output": {"aspect": "9:16", "fps": 30, "target_duration": 60},
  "bgm": {"path": "raw/bgm.mp3", "volume": 0.25, "duck_under_speech": true},
  "clips": [
    {"seq": 1, "source": "v010", "in": 3.0, "out": 6.5, "keep_audio": true,
     "title": {"text": "2025.03.16 · 溪頭", "style": "center"}, "transition_out": "crossfade"},
    {"seq": 2, "source": "p002", "start": 0, "duration": 2.5, "effect": "kenburns",
     "kenburns": {"from": [0.45, 0.6, 1.0], "to": [0.45, 0.55, 1.12]},
     "title": {"text": "下雨天，也要出門", "style": "lower-third"}, "transition_out": "crossfade"},
    {"seq": 3, "source": "v002", "in": 9.5, "out": 12.5, "keep_audio": false, "transition_out": "cut"},
    {"seq": 4, "source": "v003", "in": 42.0, "out": 48.0, "keep_audio": true, "transition_out": "cut"},
    {"seq": 5, "source": "v005", "in": 0.0, "out": 5.0, "keep_audio": true,
     "title": {"text": "木頭恐龍", "style": "chapter"}, "transition_out": "cut"},
    {"seq": 6, "source": "v004", "in": 47.0, "out": 50.0, "keep_audio": true, "transition_out": "crossfade"},
    {"seq": 7, "source": "v007", "in": 330.0, "out": 336.0, "keep_audio": false,
     "audio_override": {"source": "v007", "in": 150.0},
     "title": {"text": "奈奈視角", "style": "chapter"}, "transition_out": "crossfade"},
    {"seq": 8, "source": "v010", "in": 273.0, "out": 277.0, "keep_audio": true, "transition_out": "cut"},
    {"seq": 9, "source": "v010", "in": 441.0, "out": 445.0, "keep_audio": true,
     "title": {"text": "達達", "style": "lower-third"}, "transition_out": "cut"},
    {"seq": 10, "source": "v008", "in": 45.0, "out": 48.5, "keep_audio": false, "crop": "center",
     "title": {"text": "奈奈", "style": "lower-third"}, "transition_out": "cut"},
    {"seq": 11, "source": "v009", "in": 61.0, "out": 64.5, "keep_audio": false, "crop": "center", "transition_out": "crossfade"},
    {"seq": 12, "source": "v010", "in": 901.0, "out": 905.0, "keep_audio": true,
     "title": {"text": "起霧了", "style": "chapter"}, "transition_out": "crossfade"},
    {"seq": 13, "source": "v012", "in": 0.0, "out": 3.5, "keep_audio": true,
     "title": {"text": "妖怪村", "style": "chapter"}, "transition_out": "cut"},
    {"seq": 14, "source": "v013", "in": 87.0, "out": 90.0, "keep_audio": false, "transition_out": "crossfade"},
    {"seq": 15, "source": "v017", "in": 50.0, "out": 55.0, "keep_audio": true, "transition_out": "cut"},
    {"seq": 16, "source": "v018", "in": 12.0, "out": 16.0, "keep_audio": true, "transition_out": "cut"},
    {"seq": 17, "source": "v016", "in": 92.0, "out": 97.0, "keep_audio": false,
     "title": {"text": "2025.03 溪頭", "style": "center"}, "transition_out": "fade-black"}
  ]
}
